{
  "id": "20260820-006",
  "title": "Cinematic Morning Coffee Ritual",
  "prompt": "Morning Coffee Ritual \n\nA fictional Western actress wakes up in a modern bedroom as warm morning sunlight filters through the curtains. She opens the curtains, walks into the kitchen, prepares fresh coffee, and pours it into a ceramic mug. Realistic liquid physics create natural ripples and rising steam as she carefully picks up the mug and walks toward the window.\n\nShe sits beside the window, takes a peaceful sip, and watches the morning light illuminate the room. Every movement follows realistic human biomechanics, gravity, momentum, cloth and hair movement, fluid dynamics, steam diffusion, and natural light behavior.\n\nUltra-realistic visuals, cinematic 35mm camera, photorealistic skin and hair, natural expressions, realistic physics, smooth camera movement, warm sunlight, shallow depth of field, subtle ambient sounds, premium lifestyle-commercial aesthetic, 4K cinematic quality.",
  "model": "seedance-2.5",
  "category": [
    "cinematic",
    "ugc"
  ],
  "language": "en",
  "author": {
    "name": "Zeeshi",
    "x_handle": "@AIwithZeeshi",
    "profile_url": "https://x.com/AIwithZeeshi"
  },
  "source": {
    "platform": "x",
    "url": "https://x.com/AIwithZeeshi/status/2090310481970143606",
    "posted_at": "2026-08-20T05:30:29Z",
    "likes": 118,
    "reposts": 3,
    "views": 3861
  },
  "media": {
    "video_url": "https://video.twimg.com/amplify_video/2090308732026859520/vid/avc1/1920x1080/zi1vDd8h0nkMFFfQ.mp4?tag=29",
    "thumb_url": "https://pbs.twimg.com/amplify_video_thumb/2090308732026859520/img/qjT_tozGe4Nn-QgB.jpg",
    "duration_sec": 15.08
  },
  "tags": [
    "morning",
    "coffee",
    "lifestyle",
    "35mm",
    "physics"
  ],
  "score": 12.2,
  "collected_at": "2026-08-20T12:00:00Z",
  "featured": false,
  "notes": "Compact 15s lifestyle commercial with fluid/steam physics emphasis."
}
