{
  "id": "20260820-005",
  "title": "Luxury Bedroom UGC Sunglasses and Earbuds Ad",
  "prompt": "Use the uploaded reference image as the exact character and product reference. Preserve the woman’s facial identity, hairstyle, eye color, makeup, skin tone, body proportions, jewelry, and overall appearance consistently throughout the entire video. Change her outfit to a fitted sleeveless PINK top with clean WHITE shorts and keep the outfit identical in every shot. Use the uploaded sunglasses, earbuds, orange retail packaging, and carrying cases as LOCKED product references. Preserve their exact shapes, colors, materials, proportions, buttons, lenses, hinges, charging case, textures, and every visible product detail. Do not redesign, replace, or invent any product elements.\n\nCreate an ultra-realistic UGC luxury lifestyle review filmed inside a modern luxury bedroom during warm golden hour. The woman is the clear visual focus, with authentic creator energy and natural expressions. Use warm sunlight coming through the bedroom windows, soft realistic shadows, natural skin texture, shallow depth of field, subtle handheld smartphone movement, realistic autofocus behavior, natural motion blur, and premium commercial-quality cinematography. Include a realistic cat naturally interacting with her only where specified, without distracting from the products.\n\n0–5 seconds:\nThe woman sits comfortably on the edge of the bed with the cat resting naturally in her lap. The orange product packaging is clearly visible beside her. She looks directly into the camera, smiles warmly, and says:\n“Okay, these two have seriously upgraded my everyday routine.”\n\n5–11 seconds:\nShe gently moves the cat beside her, picks up the sunglasses, opens the orange packaging, and slowly reveals the sunglasses. She brings them closer to the camera and rotates them naturally so the frame, lenses, hinges, and finish are clearly visible. She says:\n“The sunglasses immediately caught my attention—the finish, the shape, everything feels so premium.”\n\n11–18 seconds:\nShe puts on the sunglasses naturally, adjusts them lightly at the temple, and looks toward the bright bedroom window. Capture a flattering side-profile moment with realistic reflections in the lenses. She then turns back toward the camera and says:\n“They’re lightweight, comfortable, and honestly look even better in natural light.”\n\n18–24 seconds:\nShe picks up the earbuds and opens their black charging case. Transition into a detailed macro close-up of the case opening and the earbuds inside. Show the actual product design with accurate proportions, realistic materials, subtle reflections, and authentic hand interaction. She says:\n“And the earbuds are the perfect everyday companion—small, sleek, and ridiculously easy to carry.”\n\n24–30 seconds:\nShe places the sunglasses and earbuds together beside their orange packaging and carrying cases. She then picks both products up, holds them naturally toward the camera, and gives a confident warm smile. She says:\n“If you love accessories that actually look as good as they perform, these are definitely worth checking out.”\n\nEnding shot:\nEnd with a slow, smooth cinematic push-in toward the sunglasses, earbuds, orange packaging, and carrying cases arranged beautifully on the softly textured bed. Keep the woman subtly visible in the background with natural depth-of-field separation. Allow the golden-hour light to create premium highlights across the products.\n\nVisual direction: Ultra-realistic UGC, authentic influencer energy, natural facial expressions, perfect lip synchronization, realistic hand anatomy and movements, physically accurate product interaction, premium fashion/lifestyle aesthetic, detailed macro product shots, accurate lens reflections, realistic materials and textures, warm golden-hour lighting, handheld smartphone cinematography, subtle focus breathing, natural exposure changes, 4K HDR, cinematic depth of field.",
  "model": "seedance-2.5",
  "category": [
    "ugc",
    "ads",
    "product"
  ],
  "language": "en",
  "author": {
    "name": "Synthia",
    "x_handle": "@AIwithSynthia",
    "profile_url": "https://x.com/AIwithSynthia"
  },
  "source": {
    "platform": "x",
    "url": "https://x.com/AIwithSynthia/status/2089932434351734933",
    "posted_at": "2026-08-19T04:28:16Z",
    "likes": 124,
    "reposts": 6,
    "views": 11153
  },
  "media": {
    "video_url": "https://video.twimg.com/amplify_video/2089932382531133440/vid/avc1/1280x720/nxlaQ9dab0eCYel2.mp4?tag=29",
    "thumb_url": "https://pbs.twimg.com/amplify_video_thumb/2089932382531133440/img/k05-QTjlyxToORTd.jpg",
    "duration_sec": 30.08
  },
  "tags": [
    "ugc",
    "product-lock",
    "golden-hour",
    "dialogue",
    "review"
  ],
  "score": 13.7,
  "collected_at": "2026-08-20T12:00:00Z",
  "featured": false,
  "notes": "30s UGC lifestyle ad with locked product refs and timed dialogue."
}
